PRODUCT,MATERIEL,GAMME,REFERENCE,DESCRIPTION,CATALOGUE,IMAGES PRODUIT,IMAGES AMBIENCE,MAIN COLOR,FINITION,ESPACES 1,ESPACES 2,ESPACES 3,ESPACES 4,ESPACES 5,ESPACES 6,UTILISATIONS,UTILISATIONS 2,UTILISATIONS 3,UTILISATIONS 4,UTILISATIONS 5,FORMATS,OPTIONS,FICHE TECNIQUE,ORIGINE
GRANIT BEIGE,GRANIT,GRANIT,2000002728,Granit jaune moucheté de différents tons. ,https://cupastonefr.servidor.gal/wp-content/uploads/sites/7/recursos/CATALOGUE_PIERRE_NATURELLE_FRANCE.pdf,"GRANIT_BEIGE_TEXTURA_WEB.jpg,GRANIT_BEIGE_PLACAGE_PRODUCTO_WEB.jpg,GRANIT_BEIGE_PAVE_10X10_PRODUCTO_WEB.jpg,GRANIT_BEIGE_DALLAGE_LL40_PRODUCTO_WEB.jpg,GRANIT_BEIGE_BORDURE_PRODUCTO_WEB.jpg,GRANIT_BEIGE_PAVE_10X10_COMPOSICION_WEB.jpg,GRANIT_BEIGE_DALLAGE_LL40_COMPOSICION_WEB.jpg",GRANIT_BEIGE_AMBIENTE_WEB.jpg,BEIGE,"ANTIQUE GRENAILLÉE,GRENAILLÉE,ÉCLATÉE",TERRASSE,PISCINE,JARDIN,,,,MUR EXTÉRIEUR,SOL EXTÉRIEUR,,,,,"DALLAGES (rives sciées vieillies), DALLAGES (rives sciées), PAVÉS (rives éclatées), PAVÉS (toutes faces éclatées), BORDURES (2 chants grenaillés), COUVERTINES (2 long chants grenaillés), MARGELLE (1 long chant droit grenaillé), BLOC MARCHÉ (2 chants grenaillés).",,
GRANIT BEIGE BRETON,GRANIT,GRANIT,2000002882,Granit beige moucheté de noir à l’aspect rustique.,https://cupastonefr.servidor.gal/wp-content/uploads/sites/7/recursos/CATALOGUE_PIERRE_NATURELLE_FRANCE.pdf,"GRANITE_BEIGE_BRETON_TEXTURA_WEB.jpg,GRANIT_BEIGE_BRETON_BARETTE_PRODUCTO_WEB.jpg,GRANIT_BEIGE_BRETON_PLACAGE_PRODUCTO_WEB.jpg",GRANITE_BEIGE_BRETO_AMBIENTE_WEB.jpg,BEIGE,"NATURELLE,ÉCLATÉE",SALON ,CUISINE,SALLE DE BAIN,JARDIN,CHEMINÉE,,MUR INTÉRIEUR,MUR EXTÉRIEUR,,,,,"BARRETTES (toutes faces áclatées), PLACAGE (face vue éclatée - arrière scié)",,
GRANIT GRIS BLEU,GRANIT,GRANIT,2000002738,Granit gris foncé avec des tâches bleues aux style rustique et aspect très naturelle.,https://cupastonefr.servidor.gal/wp-content/uploads/sites/7/recursos/CATALOGUE_PIERRE_NATURELLE_FRANCE.pdf,"GRANIT_GRIS_BLEU_TEXTURA_WEB.jpg,GRANIT_GRIS_BLEU_PAVE_10X10_PRODUCTO_WEB.jpg,GRANIT_GRIS_BLEU_PAVE_15X15_PRODUCTO_WEB.jpg,GRANIT_GRIS_BLEU_PAVE_10X10_COMPOSICION_WEB.jpg",GRANIT_GRIS_BLEU_AMBIENTE_WEB.jpg,GRIS,"ÉCLATÉE,GRENAILLÉ",,,,,,,,,,,,,"PAVÉS (toutes faces éclatées), PAVÉS (rives éclatées)",,
GRANIT GRIS FONCÉ CAMBODGE,GRANIT,GRANIT,2000055383,Granit de couleur gris avec des taches blanches et noire. Aspect élégant.,https://cupastonefr.servidor.gal/wp-content/uploads/sites/7/recursos/CATALOGUE_PIERRE_NATURELLE_FRANCE.pdf,"GRANIT_GRIS_FONCE_TEXTURA_WEB.jpg,GRANIT_GRIS_FONCE_DALLAGE_80X80_PRODUCTO_WEB.jpg,GRANIT_GRIS_FONCE_DALLAGE_100X100_PRODUCTO_WEB.jpg,GRANIT_GRIS_FONCE_MARGELLE_PRODUCTO_WEB.jpg,GRANIT_GRIS_FONCE_PAVE_12X12_PRODUCTO_WEB.jpg,GRANIT_GRIS_FONCE_DALLAGE_60X40_COMPOSICION_WEB.jpg,GRANIT_GRIS_FONCE_PAVE_20X14_COMPOSICION_WEB.jpg",GRANIT_GRIS_FONCE_AMBIENTE_WEB.jpg,GRIS,"FLAMMÉE-BROSSÉE,ANTIQUE,BROSSÉE ",,,,,,,MUR INTÉRIEUR,MUR EXTÉRIEUR,SOL EXTÉRIEUR,,,,"DALLAGE, PAVËS, MARGELLE et COUVERTINES (Chant vus flammés et chanfreinés), BORDURES, BLOC MARCHE",,
INFERCOA,QUARTZITE,INFERCOA,2000045557,"Ardoise naturelle dans les tons noirs avec des nuances brillantes et grises. D’aspect rustique et naturel, INFERCOA se caractérise par sa rugosité et sa grande résistance. Oxydation naturelle.",https://cupastonefr.servidor.gal/wp-content/uploads/sites/7/recursos/CATALOGUE_PIERRE_NATURELLE_FRANCE.pdf,"INFERCOA_TEXTURA_WEB.jpg,INFERCOA_BARETTE_PRODUCTO_WEB.jpg,INFERCOA_PALIS2FS_PRODUCTO_WEB.jpg,INFERCOA_PALIS4FS_PRODUCTO_WEB.jpg,INFERCOA_PAS_PRODUCTO_WEB.jpg,INFERCOA_PIQUET_PRODUCTO_WEB.jpg",INFERCOA_AMBIENTE_WEB.jpg,NOIRE,"NATURELLE,ÉCLATÉE",TERRASSE,JARDIN,,,,,MUR EXTÉRIEUR,SOL EXTÉRIEUR,,,,,"PIQUETS (2 bouts sciés - autres faces naturelles), PALIS (2 bouts sciés - autres faces naturelles) - Largeur +/- 30 cm, PALIS (2 bouts sciés - autres faces naturelles) - Largeur +/- 50 cm, BARRETTES, PAS JAPONAIS, BLOC MARCHÉ",,
ARDOISE FUJI,ARDOISE,PIERRE NATURELLE D'EXTERIEUR,2000055328,Ardoise unique avec une structure en relief aux multiples effets décoratifs. Ses teintes variées sont la touche d'élégance qui garantissent un décor singulier,https://cupastonefr.servidor.gal/wp-content/uploads/sites/7/recursos/CATALOGUE_PIERRE_NATURELLE_FRANCE.pdf,"ARDOISE_FUJI_TEXTURA_WEB.jpg,ARDOISE_MUSTANG_PALIS_80X30_PRODUCTO_WEB.jpg,ARDOISE_MUSTANG_PALIS_80X50_PRODUCTO_WEB.jpg,ARDOISE_MUSTANG_PALIS_100X30_PRODUCTO_WEB.jpg,ARDOISE_MUSTANG_PALIS_120X30_PRODUCTO_WEB.jpg,ARDOISE_MUSTANG_PALIS_120X50_PRODUCTO_WEB.jpg",ARDOISE_FUJI_AMBIENTE_WEB.jpg,NOIRE,"NATURELLE,NATURELLE",,,,,,,,,,,,,PALIS (4 cotés sciés) - finition naturelle,,
ARDOISE MUSTANG,ARDOISE,PIERRE NATURELLE D'EXTERIEUR,2000046942,"Ardoise noire d’aspect rustique et irrégulier, c’est une roche métamorphique à grain très fin.",https://cupastonefr.servidor.gal/wp-content/uploads/sites/7/recursos/CATALOGUE_PIERRE_NATURELLE_FRANCE.pdf,"ARDOISE_MUSTANG_TEXTURA_WEB.jpg,ARDOISE_MUSTANG_MARGELLE_PRODUCTO_WEB.jpg,ARDOISE_MUSTANG_PAVE_15x15_PRODUCTO_WEB.jpg,ARDOISE_MUSTANG_DALLAGE_40X60_COMPOSICION_WEB.jpg,ARDOISE_MUSTANG_PAVE_15X15_COMPOSICION_WEB.jpg",ARDOISE_MUSTANG_AMBIENTE_WEB.jpg,NOIRE,"NATURELLE,NATURELLE-VIEILLIE",PISCINE,SALON,CUISINE,SALLE DE BAIN,TERRASSE,JARDIN,MUR INTÉRIEUR,MUR EXTÉRIEUR,SOL INTÉRIEUR,SOL EXTÉRIEUR,,,"DALLAGES (rives sciées), PAVÉS (rives sciées vieillies), MARGELLES (rives sciées - chant vu nez droit chanfreiné)",,
STONETACK®,,STONETACK,2000051709,,,,,,NATURELLE,SALON ,CUISINE,SALLE DE BAIN,CHEMINÉE,,,MUR INTÉRIEUR,,,,,,PAREMENT MURAL,,
NIDAGRAVEL,,STABILISATEUR DE PIERRE,2000002753,"129+ - Installé en pied de mur, les petites plaques nidagravel ont une dimension adaptée à la réalisation de bandes de graviers en périphérie de la maison.
130-140 - Les dimensions des plaques Nidagravel® 130-140 sont adaptées à la réalisation de grands chantiers et permettent ainsi une pose rapide et facile.",,,,,,,,,,,,,,,,,,STABILISATEURS DE GRAVIERS,,