PRODUCT,MATERIEL,GAMME,REFERENCE,DESCRIPTION,CATALOGUE,IMAGES PRODUIT,IMAGES AMBIENCE,MAIN COLOR,FINITION,ESPACES 1,ESPACES 2,ESPACES 3,ESPACES 4,ESPACES 5,ESPACES 6,UTILISATIONS,UTILISATIONS 2,UTILISATIONS 3,UTILISATIONS 4,UTILISATIONS 5,FORMATS,OPTIONS,FICHE TECNIQUE,ORIGINE
CALCAIRE ALHAMBRA BEIGE,CALCAIRE,AGREGATS,2000049586,"Roche calcaire de couleur beige, composée de sédiments minéraux lui procurant une jolie texture claire.",https://cupastonefr.servidor.gal/wp-content/uploads/sites/7/recursos/CATALOGUE_PIERRE_NATURELLE_FRANCE.pdf,"CALCAIRE_ALHAMBRA_BEIGE_BROSSE_TEXTURA_WEB.jpg,CALCAIRE_ALHAMBRA_BEIGE_TUMBLED_TEXTURA_WEB.jpg,CALCAIRE_ALHAMBRA_BEIGE_BROSSE_DALLAGE_60X40_PRODUCTO_WEB.jpg,CALCAIRE_ALHAMBRA_BEIGE_BROSSE_MARGELLE_60X30_PRODUCTO_WEB.jpg,CALCAIRE_ALHAMBRA_BEIGE_TUMBLED_DALLAGE_60X40_PRODUCTO_WEB.jpg,CALCAIRE_ALHAMBRA_BEIGE_TUMBLED_MARGELLE_60X30_PRODUCTO_WEB.jpg,CALCAIRE_ALHAMBRA_BEIGE_TUMBLED_MARGELLE_45X45_PRODUCTO_WEB.jpg,CALCAIRE_ALHAMBRA_BEIGE_BROSSE_DALLAGE_60X40_COMPOSICION_WEB.jpg,CALCAIRE_ALHAMBRA_BEIGE_BROSSE_DALLAGE_OPUS4_COMPOSICION_WEB.jpg,CALCAIRE_ALHAMBRA_BEIGE_TUMBLED_DALLAGE_60X40_COMPOSICION_WEB.jpg,CALCAIRE_ALHAMBRA_BEIGE_TUMBLED_DALLAGE_OPUS4_COMPOSICION_WEB.jpg,CALCAIRE_ALHAMBRA_BEIGE_TUMBLED_PAVE_15X15_COMPOSICION_WEB.jpg",CALCAIRE_ALHAMBRA_BEIGE_AMBIENTE_WEB.jpg,BEIGE,SABLÉE-BROSSÉE,PISCINE,SALON,CUISINE,SALLE DE BAIN,TERRASSE,JARDIN,MUR INTÉRIEUR,MUR EXTÉRIEUR,SOL INTÉRIEUR,SOL EXTÉRIEUR,,,"DALLAGES (rives sciées), MARGELLES (rives scées viellies - chant vu nez 1/2 rond)",,
CALCAIRE ALHAMBRA GRIS,CALCAIRE,AGREGATS,2000055038,"Roche calcaire de couleur gris, composée de sédiments minéraux lui procurant une jolie texture claire.",https://cupastonefr.servidor.gal/wp-content/uploads/sites/7/recursos/CATALOGUE_PIERRE_NATURELLE_FRANCE.pdf,"CALCAIRE_ALHAMBRA_GRIS_BROSSE_TEXTURA_WEB.jpg,CALCAIRE_ALHAMBRA_GRIS_TUMBLED_TEXTURA_WEB.jpg,CALCAIRE_ALHAMBRA_GRIS_BROSSE_DALLAGE_60X40_PRODUCTO_WEB.jpg,CALCAIRE_ALHAMBRA_GRIS_BROSSE_MARGELLE_60X30_PRODUCTO_WEB.jpg,CALCAIRE_ALHAMBRA_GRIS_TUMBLED_DALLAGE_60X40_PRODUCTO_WEB.jpg,CALCAIRE_ALHAMBRA_GRIS_TUMBLED_MARGELLE_60X30_PRODUCTO_WEB.jpg,CALCAIRE_ALHAMBRA_GRIS_BROSSE_DALLAGE_60X40_COMPOSICION_WEB.jpg,CALCAIRE_ALHAMBRA_GRIS_BROSSE_DALLAGE_OPUS4_COMPOSICION_WEB.jpg,CALCAIRE_ALHAMBRA_GRIS_TUMBLED_DALLAGE_60X40_COMPOSICION_WEB.jpg,CALCAIRE_ALHAMBRA_GRIS_TUMBLED_DALLAGE_OPUS4_COMPOSICION_WEB.jpg",CALCAIRE_ALHAMBRA_GRIS_AMBIENTE_WEB.jpg,GRIS,SABLE-BROSSÉE,PISCINE,SALON,CUISINE,SALLE DE BAIN,TERRASSE,JARDIN,MUR INTÉRIEUR,MUR EXTÉRIEUR,SOL INTÉRIEUR,SOL EXTÉRIEUR,,,"DALLAGES (rives sciées), MARGELLES (rives scées viellies - chant vu nez 1/2 rond)",,
ARDOISE CARRÉ NOIRE (ESP),,,,"Ardoise naturelle avec une surface légèrement structurée. Parfaitement adaptée à l’usage extérieur, cette roche s’accorde facilement à des projets d’aménagement paysager.",https://cupastonefr.servidor.gal/wp-content/uploads/sites/7/recursos/CATALOGUE_PIERRE_NATURELLE_FRANCE.pdf,",,",,,,,,,,,,,,,,,,,,
CALCAIRE AMPILLY,CALCAIRE,AGREGATS,2000048406,"Ce calcaire discret et raffiné aux nuances de beige clair à miel a un aspect très naturel avec ses quelques veinages. Il est un « grand classique »,.",https://cupastonefr.servidor.gal/wp-content/uploads/sites/7/recursos/CATALOGUE_PIERRE_NATURELLE_FRANCE.pdf,"CALCAIRE_AMPILLY_TEXTURA_WEB.jpg,CALCAIRE_AMPILLY_DALLAGE_60X40_PRODUCTO_WEB.jpg,CALCAIRE_AMPILLY_DALLAGE_LL50_PRODUCTO_WEB.jpg,CALCAIRE_AMPILLY_DALLAGE_LL50_COMPOSICION_WEB.jpg,CALCAIRE_AMPILLY_DALLAGE_OPUS4_COMPOSICION_WEB.jpg",CALCAIRE_AMPILLY_AMBIENTE_WEB.jpg,BEIGE,"ANTIQUE,BROSSËE",PISCINE,SALON,CUISINE,SALLE DE BAIN,TERRASSE,JARDIN,SOL INTÉRIEUR,SOL EXTÉRIEUR,,,,,"DALLAGES (rives sciées vieillies), DALLAGES (rives sciées)",,
CALCAIRE DE BAVIERE,CALCAIRE,AGREGATS,2000002276,,https://cupastonefr.servidor.gal/wp-content/uploads/sites/7/recursos/CATALOGUE_PIERRE_NATURELLE_FRANCE.pdf,",,",,,,,,,,,,,,,,,,,,
CALCAIRE AVALLON GRIS,CALCAIRE,AGREGATS,2000044090,"Roche sédimentaire moyenne à grains fins de couleur grise avec des tâches noires. Elle est hétérogène, avec des zones où les dimensions des composants sont plus petites.",https://cupastonefr.servidor.gal/wp-content/uploads/sites/7/recursos/CATALOGUE_PIERRE_NATURELLE_FRANCE.pdf,"CALCAIRE_AVALLON_GRIS_TEXTURA_WEB.jpg,CALCAIRE_AVALLON_GRIS_DALLAGE_60X40_PRODUCTO_WEB.jpg,CALCAIRE_AVALLON_GRIS_MARGELLE_PRODUCTO_WEB.jpg,CALCAIRE_AVALLONS_GRIS_DALLAGE_60X40_COMPOSICION_WEB.jpg,CALCAIRE_AVALLONS_GRIS_DALLAGE_OPUS4_COMPOSICION_WEB.jpg",CALCAIRE_AVALLON_GRIS_AMBIENTE_WEB.jpg,GRIS,ANTIQUE,PISCINE,SALON,CUISINE,SALLE DE BAIN,TERRASSE,JARDIN,MUR INTÉRIEUR,MUR EXTÉRIEUR,SOL INTÉRIEUR,SOL EXTÉRIEUR,,,"DALLAGES (rives sciées viellies), MARGELLES (rives sciées viellies - chant vu nez 1/2 rond)",,
CALCAIRE BLEU D'ASIE,CALCAIRE,AGREGATS,2000047573,"Roche sédimentaire calcaire, compacte, réputée pour sa dureté et sa très faible porosité. Une forte présence de fossiles animaux et de coquillages qui confère les nuances du bleu foncé au gris bleu si typiques et si particulières.",https://cupastonefr.servidor.gal/wp-content/uploads/sites/7/recursos/CATALOGUE_PIERRE_NATURELLE_FRANCE.pdf,"CALCAIRE_BLEU_ASIE_TEXTURA_WEB.jpg,CALCAIRE_BLEU_ASIE_PAVE_10X10_PRODUCTO_WEB.jpg,CALCAIRE_BLEU_ASIE_MARGELLE_60X30_PRODUCTO_WEB.jpg,CALCAIRE_BLEU_ASIE_DALLAGE_60X40_PRODUCTO_WEB.jpg,CALCAIRE_BLEU_ASIE_BORDURE_PRODUCTO_WEB.jpg,CALCAIRE_BLEU_LACTE_DALLAGE_60X40_COMPOSICION_WEB.jpg,CALCAIRE_BLEU_LACTE_DALLAGE_OPUS4_COMPOSICION_WEB.jpg",CALCAIRE_BLEU_ASIE_AMBIENTE_WEB.jpg,BLEUE,"ANTIQUE,2 CHANTS ADOUCIS",PISCINE,SALON,CUISINE,SALLE DE BAIN,TERRASSE,JARDIN,MUR EXTÉRIEUR,SOL INTÉRIEUR,SOL EXTÉRIEUR,,,,"DALLAGES (rives sciées viellies), PAVÉS (rives sciées viellies), BORDURE (rives sciées), MARGELLES (rives sciées viellies - chant vu nez 1/2 rond)",,
CALCAIRE BLEU LACTÉ,CALCAIRE,AGREGATS,2000050157,Roche sédimentaire résistante avec des tonalités bleu clair. Cette pierre naturelle transmet une certaine clarté pour un style minimal et stylisé.,https://cupastonefr.servidor.gal/wp-content/uploads/sites/7/recursos/CATALOGUE_PIERRE_NATURELLE_FRANCE.pdf,"CALCAIRE_BLEU_LACTE_TEXTURA_WEB.jpg,CALCAIRE_BLEU_LACTE_PAVE_10X10_PRODUCTO_WEB.jpg,CALCAIRE_BLEU_LACTE_MARGELLE_60X30_PRODUCTO_WEB.jpg,CALCAIRE_BLEU_LACTE_DALLAGE_60X40_PRODUCTO_WEB.jpg,CALCAIRE_BLEU_LACTE_DALLAGE_60X60_COMPOSICION_WEB.jpg,CALCAIRE_BLEU_LACTE_DALLAGE_OPUS4_COMPOSICION_WEB.jpg,CALCAIRE_BLEU_LACTE_PAVE_15X15_COMPOSICION_WEB.jpg",CALCAIRE_BLEU_LACTE_AMBIENTE_WEB.jpg,BLEUE,"SABLÉE,ANTIQUE SABLÉE",PISCINE,SALON,CUISINE,SALLE DE BAIN,TERRASSE,JARDIN,MUR INTÉRIEUR,MUR EXTÉRIEUR,SOL INTÉRIEUR,SOL EXTÉRIEUR,,,"DALLAGES (rives sciées), PAVÉS (rives sciées vieillies), MARGELLES (rives sciées - chant vu nez droit chanfreiné)",,
CALCAIRE CHABLIS BEIGE,CALCAIRE,AGREGATS,2000044082,Roche calcaire de couleur beige et sable,https://cupastonefr.servidor.gal/wp-content/uploads/sites/7/recursos/CATALOGUE_PIERRE_NATURELLE_FRANCE.pdf,"CALCAIRE_CHABLIS_BEIGE_TEXTURA_WEB.jpg,CALCAIRE_CHABLIS_BEIGE_DALLAGE_60X40_PRODUCTO_WEB.jpg,CALCAIRE_CHABLIS_BEIGE_MARGELLE_PRODUCTO_WEB.jpg,CALCAIRE_CHABLIS_BEIGE_PAVE_15X15_PRODUCTO_WEB.jpg,CALCAIRE_CHABLIS_BEIGE_DALLAGE_OPUS4_COMPOSICION_WEB.jpg,CALCAIRE_CHABLIS_BEIGE_DALLAGE_60X40_COMPOSICION_WEB.jpg,CALCAIRE_CHABLIS_BEIGE_PAVE_15X15_COMPOSICION_WEB.jpg",CALCAIRE_CHABLIS_BEIGE_AMBIENTE_WEB.jpg,BEIGE,ANTIQUE,PISCINE,SALON,CUISINE,SALLE DE BAIN,TERRASSE,JARDIN,MUR INTÉRIEUR,MUR EXTÉRIEUR,SOL INTÉRIEUR,SOL EXTÉRIEUR,,,"DALLAGES (rives sciées viellies), PAVÉS (rives sciées viellies), MARGELLES (rives sciées viellies - chant vu nez 1/2 rond)",,
CALCAIRE DE L'YONNE,CALCAIRE,AGREGATS,2000002278,Calcaire beige aux touches de jaune.,https://cupastonefr.servidor.gal/wp-content/uploads/sites/7/recursos/CATALOGUE_PIERRE_NATURELLE_FRANCE.pdf,"CALCAIRE_YONNE_TEXTURA_WEB.jpg,CALCAIRE_YONNE_BARETTE_PRODUCTO_WEB.jpg,CALCAIRE_YONNE_PAS_PRODUCTO_WEB.jpg",CALCAIRE_YONNE_AMBIENTE_WEB.jpg,BEIGE,"NATURELLE,ÉCLATÉE",SALON ,CUISINE,CHEMINÉE,JARDIN,TERRASSE,,MUR INTÉRIEUR,MUR EXTÉRIEUR,SOL EXTÉRIEUR,,,,"DALLAGES (toutes faces naturelles), BARRETTES (toutes faces éclatées)",,
CALCAIRE KOTHA BRUN,CALCAIRE,AGREGATS,2000043818,Roche calcaire dolomite de nuances verte et brune.,https://cupastonefr.servidor.gal/wp-content/uploads/sites/7/recursos/CATALOGUE_PIERRE_NATURELLE_FRANCE.pdf,"CALCAIRE_KOTHA_BRUN_TEXTURA_WEB.jpg,CALCAIRE_KOTHA_BRUN_PAVE_24X18_PRODUCTO_WEB.jpg,CALCAIRE_KOTHA_BRUN_PAVE_18X12_PRODUCTO_WEB.jpg,CALCAIRE_KOTHA_BRUN_PAVE_12X12_PRODUCTO_WEB.jpg,CALCAIRE_KOTHA_BRUN_MARGELLE_PRODUCTO_WEB.jpg,CALCAIRE_KOTHA_BRUN_DALLAGE_60X40_PRODUCTO_WEB.jpg,CALCAIRE_KOTHA_BRUN_COUVERTINE_PRODUCTO_WEB.jpg,CALCAIRE_KOTHA_BRUN_BORDURE_PRODUCTO_WEB.jpg,CALCAIRE_KOTHA_BRUN_PAVE_12X12_COMPOSICION_WEB.jpg,CALCAIRE_KOTHA_BRUN_DALLAGE_60X40_COMPOSICION_WEB.jpg,CALCAIRE_KOTHA_BRUN_DALLAGE_OPUS4_COMPOSICION_WEB.jpg",CALCAIRE_KOTHA_BRUN_AMBIENTE_WEB.jpg,BRUN,NATURELLE-VIEILLIE,PISCINE,SALON,CUISINE,SALLE DE BAIN,TERRASSE,JARDIN,SOL INTÉRIEUR,SOL EXTÉRIEUR,,,,,"DALLAGES (rives éclatées vieillies), DALLAGES (rives sciées viellies), PAVÉS (rives sciées viellies), MARGELLES (rives sciées viellies - chant vu nez 1/2 rond), COUVERTINES (rives éclatées vieillies), BORDURES (rives éclatées vieillies)",,
CALCAIRE KOTHA GRIS,CALCAIRE,AGREGATS,2000043819,Roche calcaire dolomite de nuances verte et brune.,https://cupastonefr.servidor.gal/wp-content/uploads/sites/7/recursos/CATALOGUE_PIERRE_NATURELLE_FRANCE.pdf,"CALCAIRE_KOTHA_GRIS_TEXTURA_WEB.jpg,CALCAIRE_KOTHA_GRIS_MARGELLE_PRODUCTO_WEB.jpg,CALCAIRE_KOTHA_GRIS_COUVERTINE_PRODUCTO_WEB.jpg,CALCAIRE_KOTHA_GRIS_BORDURE_PRODUCTO_WEB.jpg,CALCAIRE_KOTHA_GRIS_DALLAGE_60X40_COMPOSICION_WEB.jpg,CALCAIRE_KOTHA_GRIS_DALLAGE_OPUS4_COMPOSICION_WEB.jpg",,GRIS,NATURELLE-VIEILLIE,PISCINE,SALON,CUISINE,SALLE DE BAIN,TERRASSE,JARDIN,SOL INTÉRIEUR,SOL EXTÉRIEUR,,,,,"DALLAGES (rives éclatées vieillies), DALLAGES (rives sciées viellies), PAVÉS (rives sciées viellies), MARGELLES (rives sciées viellies - chant vu nez 1/2 rond), COUVERTINES (rives éclatées vieillies), BORDURES (rives éclatées vieillies)",,
CALCAIRE MONTIGNY,CALCAIRE,AGREGATS,2000053284,"Les nuances naturelles de beige, doré et ocre de ce calcaire sont particulièrement harmonieuses.",https://cupastonefr.servidor.gal/wp-content/uploads/sites/7/recursos/CATALOGUE_PIERRE_NATURELLE_FRANCE.pdf,"CALCAIRE_MONTIGNY_TEXTURA_WEB.jpg,CALCAIRE_MONTIGNY_DALLAGE_60X40_PRODUCTO_WEB.jpg,CALCAIRE_MONTIGNY_DALLAGE_LL50_PRODUCTO_WEB.jpg,CALCAIRE_MONTIGNY_DALLAGE_LL50_COMPOSICION_WEB.jpg,CALCAIRE_MONTIGNY_DALLAGE_OPUS4_COMPOSICION_WEB.jpg",CALCAIRE_MONTIGNY_AMBIENTE_WEB.jpg,BEIGE,"ANTIQUE,BROSSËE",PISCINE,SALON,CUISINE,SALLE DE BAIN,TERRASSE,JARDIN,SOL INTÉRIEUR,SOL EXTÉRIEUR,,,,,"DALLAGES (rives sciées vieillies), DALLAGES (rives sciées)",,
CALCAIRE SAINT AMBREUIL,CALCAIRE,AGREGATS,2000041635,Calcaire à la couleur blanc-beige très épurée. Aspect brillant. Pierre haut de gamme.,https://cupastonefr.servidor.gal/wp-content/uploads/sites/7/recursos/CATALOGUE_PIERRE_NATURELLE_FRANCE.pdf,"CALCAIRE_SAINT_AMBREUIL_TEXTURA_WEB.jpg,CALCAIRE_SAINT_AMBREUIL_MARGELLE_PRODUCTO_WEB.jpg,CALCAIRE_SAINT_AMBREUIL_DALLAGE_60X40_PRODUCTO_WEB.jpg,CALCAIRE_SAINT_AMBREUIL_DALLAGE_60X60_COMPOSICION_WEB.jpg",CALCAIRE_SAINT_AMBREUIL_AMBIENTE_WEB.jpg,BEIGE,SABLÉE-BROSSÉE,PISCINE,SALON,CUISINE,SALLE DE BAIN,TERRASSE,JARDIN,MUR INTÉRIEUR,MUR EXTÉRIEUR,SOL INTÉRIEUR,SOL EXTÉRIEUR,,,DALLAGES (rives sciées),,
GNEISS BIASCA,GNEISS,AGREGATS,2000052100,"Pierre naturelle légèrement structurée du fait de sa finition flammée, ses nuances de gris plus ou moins soutenues en font une pierre moderne et élégante parfaite pour vos projets extérieurs.",https://cupastonefr.servidor.gal/wp-content/uploads/sites/7/recursos/CATALOGUE_PIERRE_NATURELLE_FRANCE.pdf,"GNEISS_BIASCA_TEXTURA_WEB.jpg,GNEISS_BIASCA_MARGELLE_80X30_PRODUCTO_WEB.jpg,GNEISS_BIASCA_DALLAGE_80X40X3_PRODUCTO_WEB.jpg,GNEISS_BIASCA_DALLAGE_120X40_PRODUCTO_WEB.jpg,GNEISS_BIASCA_DALLAGE_80X40_COMPOSICION_WEB.jpg,GNEISS_BIASCA_DALLAGE_120X40_COMPOSICION_WEB.jpg",GNEISS_BIASCA_AMBIENTE_WEB.jpg,GRIS,FLAMMÉE,PISCINE,SALON,CUISINE,SALLE DE BAIN,TERRASSE,JARDIN,SOL INTÉRIEUR,SOL EXTÉRIEUR,,,,,"DALLAGES (rives sciées), MARGELLE (bord droit flammé)",,
GNEISS GRIS ROUX,GNEISS,AGREGATS,2000002651,Quartzite de couleur gris roux au style rustique et à l’aspect très chaleureux,https://cupastonefr.servidor.gal/wp-content/uploads/sites/7/recursos/CATALOGUE_PIERRE_NATURELLE_FRANCE.pdf,"GNEISS_GRIS_ROUX_TEXTURA_WEB.jpg,GNEISS_GRIS_ROUX_DALLAGE_LL40_PRODUCTO_WEB.jpg,GNEISS_GRIS_ROUX_PAVE_15X15_PRODUCTO_WEB.jpg,GNEISS_GRIS_ROUX_DALLAGE_LL40_COMPOSICION_WEB.jpg,GNEISS_GRIS_ROUX_OPUS_INCERTUM_COMPOSICION_WEB.jpg",GNEISS_GRIS_ROUX_AMBIENTE_WEB.jpg,GRIS,"NATURELLE,NATURELLE-VIEILLIE",TERRASSE,PISCINE,JARDIN,,,,SOL EXTÉRIEUR,,,,,,"DALLAGES (rives sciées), PAVÉS (rives sciées vieillies)",,
GNEISS SAINT YRIEIX,GNEISS,AGREGATS,2000002297,Roche de couleur brun-orangé et d’aspect brillant. Elle présente un litage marqué alternant de très fines couches de couleur claire et d’autres plus paisses et plus sombres. La roche est légèrement altérée et possède une légère porosité suivant les lits.,https://cupastonefr.servidor.gal/wp-content/uploads/sites/7/recursos/CATALOGUE_PIERRE_NATURELLE_FRANCE.pdf,"GNEISS_ST_YRIEIX_TEXTURA_WEB.jpg,GNEISS_ST_YRIEIX_MOELLON_PRODUCTO_WEB.jpg,GNEISS_ST_YRIEIX_PAREMENT_PRODUCTO_WEB.jpg,GNEISS_ST_YRIEIX_PAS_PRODUCTO_WEB.jpg,GNEISS_ST_YRIEIX_PLAC_PRODUCTO_WEB.jpg,GNEISS_ST_YRIEIX_OPUS_INCERTUM_COMPOSICION_WEB.jpg",GNEISS_ST_YRIEIX_AMBIENTE_WEB.jpg,BEIGE,"NATURELLE,ÉCLATÉE",SALON ,CUISINE,SALLE DE BAIN,TERRASSE,JARDIN,CHEMINÉE,MUR INTÉRIEUR,MUR EXTÉRIEUR,SOL INTÉRIEUR,SOL EXTÉRIEUR,,,"DALLAGES, BARRETTES, MOELLONS, PLACAGES DE BARRETTES, DALLES DE RIVES (dessus de mur)",,
GRÈS GRIS,GRÈS,AGREGATS,2000048383,"Roche en grès naturel clivée se caractérisant par sa dureté, sa longévité, son grain fin. Elle est composée de sédiments minéraux accumulés depuis des millénaires.",https://cupastonefr.servidor.gal/wp-content/uploads/sites/7/recursos/CATALOGUE_PIERRE_NATURELLE_FRANCE.pdf,"GRES_GRIS_TEXTURA_WEB.jpg,GRES_GRIS_PAVE_14X14_PRODUCTO_WEB.jpg,GRES_GRIS_DALLAGE_60X40_PRODUCTO_WEB.jpg,GRES_GRIS_PALIS_PRODUCTO_WEB.jpg,GRES_GRIS_PALIS 2_PRODUCTO_WEB.jpg,GRES_GRIS_DALLAGE_60X40_COMPOSICION_WEB.jpg,GRES_GRIS_PAVE_14X14_COMPOSICION_WEB.jpg,GRES_GRIS_DALLAGE_OPUS4_COMPOSICION_WEB.jpg",GRES_GRIS_AMBIENTE_WEB.jpg,GRIS,"NATURELLE-VIEILLIE,NATURELLE",PISCINE,SALON,CUISINE,SALLE DE BAIN,TERRASSE,JARDIN,SOL INTÉRIEUR,SOL EXTÉRIEUR,,,,,"DALLAGES (rives éclatées vieillies), PAVÉS (rives éclatées viellies), PAVÉS (rives éclatées), PALIS (rives éclatées), MARGELLES (rives sciées viellies - chant vu nez 1/2 rond), BLOC MARCHE (rives éclatées), PIQUET (rives éclatées)",,
GRÈS METISSAY des Indes,GRÈS,AGREGATS,2000043373,"Roche en grès naturel clivée se caractérisant par sa dureté, sa longévité, son grain fin. Elle est composée de sédiments minéraux accumulés depuis des millénaires",https://cupastonefr.servidor.gal/wp-content/uploads/sites/7/recursos/CATALOGUE_PIERRE_NATURELLE_FRANCE.pdf,"GRES_METISSAY_TEXTURA_WEB.jpg,GRES_METISSAY_BORDURE_PRODUCTO_WEB.jpg,GRES_METISSAY_DALLAGE_60X40_PRODUCTO_WEB.jpg,GRES_METISSAY_MARCHE_PRODUCTO_WEB.jpg,GRES_METISSAY_MARGELLE_PRODUCTO_WEB.jpg,GRES_METISSAY_PALIS_PRODUCTO_WEB.jpg,GRES_METISSAY_PALIS 2_PRODUCTO_WEB.jpg,GRES_METISSAY_PAVE_14X14_PRODUCTO_WEB.jpg,GRES_METISSAY_DALLAGE_60X40_COMPOSICION_WEB.jpg,GRES_METISSAY_PAVE_MIXTE_COMPOSICION_WEB.jpg,GRES_METISSAY_DALLAGE_OPUS4_COMPOSICION_WEB.jpg",GRES_METISSAY_AMBIENTE_WEB.jpg,MARRON,"NATURELLE-VIEILLIE,NATURELLE",PISCINE,SALON,CUISINE,SALLE DE BAIN,TERRASSE,JARDIN,SOL INTÉRIEUR,SOL EXTÉRIEUR,,,,,"DALLAGES (rives éclatées vieillies), PAVÉS (rives éclatées viellies), PAVÉS (rives éclatées viellies), BORDURES (rives éclatées), MARGELLES (rives sciées viellies - chant vu nez 1/2 rond), BLOC MARCHE (rives éclatées), PIQUET (rives éclatées)",,
MARBRE BLEU IZMIR,MARBRE,AGREGATS,2000002686,"Roche calcaire proche du travertin au ton bleu, avec de faibles nuances apparentes donnant une couleur uniforme",https://cupastonefr.servidor.gal/wp-content/uploads/sites/7/recursos/CATALOGUE_PIERRE_NATURELLE_FRANCE.pdf,"MARBRE_BLEU_IZMIR_TEXTURA_WEB.jpg,MARBRE_BLEU_IZMIR_MARGELLE_PRODUCTO_WEB.jpg,MARBRE_BLEU_IZMIR_DALLAGE_60X40_COMPOSICION_WEB.jpg,MARBRE_BLEU_IZMIR_DALLAGE_OPUS4_COMPOSICION_WEB.jpg",MARBRE_BLEU_IZMIR_AMBIENTE_WEB.jpg,BLEUE,ANTIQUE,PISCINE,SALON,CUISINE,SALLE DE BAIN,TERRASSE,JARDIN,MUR INTÉRIEUR,MUR EXTÉRIEUR,SOL INTÉRIEUR,SOL EXTÉRIEUR,,,"DALLAGES (rives sciées viellies), MARGELLES (rives sciées viellies - chant vu nez 1/2 rond)",,
QUARTZITE ALBINO JAUNE,QUARTZITE,AGREGATS,2000002527,"Le quartzite du Brésil est un matériau très dur, sa surface lisse et régulière, mais suffisamment rugueuse pour lui conférer des qualités antidérapantes exceptionnelles.",https://cupastonefr.servidor.gal/wp-content/uploads/sites/7/recursos/CATALOGUE_PIERRE_NATURELLE_FRANCE.pdf,"QUARTZITE_ALBINO_JAUNE_TEXTURA_WEB.jpg,QUARTZITE_ALBINO_JAUNE_DALLAGE_OPUS_PRODUCTO_WEB.jpg,QUARTZITE_ALBINO_JAUNE_MARGELLE_PRODUCTO_WEB.jpg,QUARTZITE_ALBINO_JAUNE_DALLAGE_47x47_COMPOSICION_WEB.jpg,QUARTZITE_ALBINO_JAUNE_DALLAGE_OP3_COMPOSICION_WEB.jpg,QUARTZITE_ALBINO_JAUNE_OPUS_INCERTUM_COMPOSICION_WEB.jpg",QUARTZITE_ALBINO_JAUNE_AMBIENTE_WEB.jpg,JAUNE,NATURELLE,SALON ,CUISINE,SALLE DE BAIN,TERRASSE,PISCINE,JARDIN,MUR INTÉRIEUR,MUR EXTÉRIEUR,SOL INTÉRIEUR,SOL EXTÉRIEUR,,,"DALLAGES (toutes faces naturelles), DALLAGES (rives sciées), MARGELLES (rives sciées - chant vu nez 1/2 rond)",,
QUARTZITE ALBINO ROSE,QUARTZITE,AGREGATS,2000002530,"Le quartzite du Brésil est un matériau très dur, sa surface lisse et régulière, mais suffisamment rugueuse pour lui conférer des qualités antidérapantes exceptionnelles.",https://cupastonefr.servidor.gal/wp-content/uploads/sites/7/recursos/CATALOGUE_PIERRE_NATURELLE_FRANCE.pdf,"QUARTZITE_ALBINO_ROSE_TEXTURA_WEB.jpg,,QUARTZITE_ALBINO_ROSE_OPUS_INCERTUM_COMPOSICION_WEB.jpg",QUARTZITE_ALBINO_ROSE_AMBIENTE_WEB.jpg,ROSE,NATURELLE,SALON ,CUISINE,SALLE DE BAIN,TERRASSE,PISCINE,JARDIN,MUR INTÉRIEUR,MUR EXTÉRIEUR,SOL INTÉRIEUR,SOL EXTÉRIEUR,,,DALLAGES (toutes faces naturelles),,
QUARTZITE LUZERNE,QUARTZITE,AGREGATS,2000002632,Roche quartzite de couleur gris foncé avec des reflets brillants à la lumière.,https://cupastonefr.servidor.gal/wp-content/uploads/sites/7/recursos/CATALOGUE_PIERRE_NATURELLE_FRANCE.pdf,"QUARTZITE_LUZERNE_TEXTURA_WEB.jpg,QUARTZITE_LUZERNE_BARETTE_PRODUCTO_WEB.jpg,QUARTZITE_LUZERNE_DALLAGE_LL30_PRODUCTO_WEB.jpg,QUARTZITE_LUZERNE_OPUS_DALLAGE_PRODUCTO_WEB.jpg,QUARTZITE_LUZERNE_PAS_PRODUCTO_WEB.jpg,QUARTZITE_LUZERNE_DALLAGE_LL30_COMPOSICION_WEB.jpg,QUARTZITE_LUZERNE_OPUS_INCERTUM_COMPOSICION_WEB.jpg",QUARTZITE_LUZERNE_TEXTURA_WEB.jpg,GRIS,NATURELLE,TERRASSE,JARDIN,,,,,MUR EXTÉRIEUR,SOL EXTÉRIEUR,,,,,"DALLAGES (toutes faces naturelles), BARRETTES (toutes faces éclatées), DALLAGES (rives martelinés)",,
TRAVERTIN LIGHT MIXTE,TRAVERTIN,AGREGATS,2000002681,Roche calcaire travertin au nuances de beige et de noisette à l’aspect brillant. ,https://cupastonefr.servidor.gal/wp-content/uploads/sites/7/recursos/CATALOGUE_PIERRE_NATURELLE_FRANCE.pdf,"TRAVERTIN_LIGHT_MIXTE_TEXTURA_WEB.jpg,TRAVERTIN_LIGHT_MIXTE_ADOUCI_TEXTURA_WEB.jpg,TRAVERTIN_LIGHT_MIXTE_ADOUCI_DALLAGE_60X40_PRODUCTO_WEB.jpg,TRAVERTIN_LIGHT_MIXTE_BLOC_MARCHE_PRODUCTO_WEB.jpg,TRAVERTIN_LIGHT_MIXTE_BORDURE_PRODUCTO_WEB.jpg,TRAVERTIN_LIGHT_MIXTE_COUVERTINES_61X25_PRODUCTO_WEB.jpg,TRAVERTIN_LIGHT_MIXTE_DALLAGE_60X40_PRODUCTO_WEB.jpg,TRAVERTIN_LIGHT_MIXTE_MARCHE_100X35_PRODUCTO_WEB.jpg,TRAVERTIN_LIGHT_MIXTE_MARGELLE_ANGLE_PRODUCTO_WEB.jpg,TRAVERTIN_LIGHT_MIXTE_MARGELLE_PRODUCTO_WEB.jpg,TRAVERTIN_LIGHT_MIXTE_PLINTHE_PRODUCTO_WEB.jpg,TRAVERTIN_LIGHT_MIXTE_ADOUCI_DALLAGE_60X40_COMPOSICION_WEB.jpg,TRAVERTIN_LIGHT_MIXTE_ADOUCI_DALLAGE_OPUS4_COMPOSICION_WEB.jpg,TRAVERTIN_LIGHT_MIXTE_DALLAGE_60X40_COMPOSICION_WEB.jpg,TRAVERTIN_LIGHT_MIXTE_DALLAGE_OPUS4_COMPOSICION_WEB.jpg,TRAVERTIN_LIGHT_MIXTE_PAVE_15X15_COMPOSICION_WEB.jpg",TRAVERTIN_LIGHT_MIXTE_AMBIENTE_WEB.jpg,BEIGE,"ANTIQUE,ADOUCI REBOUCHÉE",PISCINE,SALON,CUISINE,SALLE DE BAIN,TERRASSE,JARDIN,MUR INTÉRIEUR,MUR EXTÉRIEUR,SOL INTÉRIEUR,SOL EXTÉRIEUR,,,"DALLAGES (rives sciées viellies), PAVÉS (rives sciées viellies MARGELLES (rives sciées viellies - chant vu nez 1/2 rond) MARCHES (rives sciées viellies - chant vu nez 1/2 rond) BLOC MARCHE (2 chants droit vus) et MARCHE PALIÈRE (4 chant droit vus) COUVERTINES (rives sciées vieillies), BORDURES (rives sciées vieillies), DALLAGES (rives sciées), PLINTHES (rives sciées vieillies), MOSAÏQUE (vieillie - carreaux de 2,3 cm de côtes)",,
TRAVERTIN MIX STANDARD,TRAVERTIN,AGREGATS,2000051852,Calcaire travertin vieillie aux nuances de beige foncé.,https://cupastonefr.servidor.gal/wp-content/uploads/sites/7/recursos/CATALOGUE_PIERRE_NATURELLE_FRANCE.pdf,"TRAVERTIN_MIX_STANDARD_TEXTURA_WEB.jpg,TRAVERTIN_MIX_STANDARD_DALLAGE_60X40_PRODUCTO_WEB.jpg,TRAVERTIN_MIX_STANDARD_MARGELLE_61X33_PRODUCTO_WEB.jpg,TRAVERTIN_MIX_STANDARD_DALLAGE_OPUS4_COMPOSICION_WEB.jpg,TRAVERTIN_MIX_STANDARD_DALLAGE_61X40_WEB.jpg",TRAVERTIN_MIX_STANDARD_AMBIENTE_WEB.jpg,BEIGE,ANTIQUE,,,,,,,MUR INTÉRIEUR,SOL INTÉRIEUR,,,,,"DALLAGES (rives sciées viellies), MARGELLES (rives sciées viellies - chant vu nez 1/2 rond)",,
TRAVERTIN SILVER,TRAVERTIN,AGREGATS,2000002688,Calcaire travertin rebouché aux nuances de bleu et de gris à l'aspect brillant,https://cupastonefr.servidor.gal/wp-content/uploads/sites/7/recursos/CATALOGUE_PIERRE_NATURELLE_FRANCE.pdf,"TRAVERTIN_SILVER_TEXTURA_WEB.jpg,TRAVERTIN_SILVER_DALLAGE_60X40_PRODUCTO_WEB.jpg,TRAVERTIN_SILVER_MARGELLE_PRODUCTO_WEB.jpg,TRAVERTIN_SILVER_DALLAGE_60X40_COMPOSICION_WEB.jpg,TRAVERTIN_SILVER_DALLAGE_OPUS4_COMPOSICION_WEB.jpg",TRAVERTIN_SILVER_AMBIENTE_WEB.jpg,GRIS,ANTIQUE,PISCINE,SALON,CUISINE,SALLE DE BAIN,TERRASSE,JARDIN,MUR INTÉRIEUR,MUR EXTÉRIEUR,SOL INTÉRIEUR,SOL EXTÉRIEUR,,,"DALLAGES (rives sciées viellies), MARGELLES (rives sciées viellies - chant vu nez 1/2 rond)",,
DECOPANEL®  ETRETAT,,DECOPANEL,2000055019,Un choix élégant pour vos intérieurs avec une tonalité craie qu'offre une distinction rustique et distinguée.,https://cupastonefr.servidor.gal/wp-content/uploads/sites/7/recursos/CUADRIPTICO_STONEPANEL_FRANCE.pdf,"DP_ETRETAT_45GRADOS_WEB.jpg,DP_ETRETAT_FRONTAL_WEB.jpg,DP_ETRETAT_COMPOSICION_WEB.jpg",,,NATURELLE,SALON ,CUISINE,SALLE DE BAIN,CHEMINÉE,,,MUR INTÉRIEUR,,,,,,PAREMENT MURAL,,
DECOPANEL®  LUNA,,DECOPANEL,2000052813,"Aux tonalités bleues et gris foncé, le mélange de couleurs donne à cette pierre une touche singulière et unique.",https://cupastonefr.servidor.gal/wp-content/uploads/sites/7/recursos/CUADRIPTICO_STONEPANEL_FRANCE.pdf,"DP_LUNA_FRONTAL_WEB.jpg,DP_LUNA_COMPOSICION_WEB.jpg",,,NATURELLE,SALON ,CUISINE,SALLE DE BAIN,CHEMINÉE,,,MUR INTÉRIEUR,,,,,,PAREMENT MURAL,,
DECOPANEL®  MULTICOLOR,,DECOPANEL,2000001646,"Ardoise marron rougeâtre, mouchetée de clair et d'obscur. Une composition originale pour des ambiances contemporaines et très modernes.",https://cupastonefr.servidor.gal/wp-content/uploads/sites/7/recursos/CUADRIPTICO_STONEPANEL_FRANCE.pdf,"DP_MULTICOLOR_45GRADOS_WEB.jpg,DP_MULTICOLOR_FRONTAL_WEB.jpg,DP_MULTICOLOR_COMPOSICION_WEB.jpg",DP_MULTICOLOR_AMBIENTE_WEB.jpg,,NATURELLE,SALON ,CUISINE,SALLE DE BAIN,CHEMINÉE,,,MUR INTÉRIEUR,,,,,,PAREMENT MURAL,,
DECOPANEL®  ORIENT,,DECOPANEL,2000001643,Quartzite dorée aux tonalités marron et gris clair. Sa finition offre une combinaison élégante et lumineuse pour des projets contemporains.,https://cupastonefr.servidor.gal/wp-content/uploads/sites/7/recursos/CUADRIPTICO_STONEPANEL_FRANCE.pdf,"DP_ORIENT_45GRADOS_WEB.jpg,DP_ORIENT_FRONTAL_WEB.jpg,DP_ORIENT_COMPOSICION_WEB.jpg",DP_ORIENT_AMBIENTE_WEB.jpg,,NATURELLE,SALON ,CUISINE,SALLE DE BAIN,CHEMINÉE,,,MUR INTÉRIEUR,,,,,,PAREMENT MURAL,,
DECOPANEL®  SYLVESTRE,,DECOPANEL,2000040897,"Pierre gneiss claire et homogène, dotée de fines lames allongées, à la finition moderne.",https://cupastonefr.servidor.gal/wp-content/uploads/sites/7/recursos/CUADRIPTICO_STONEPANEL_FRANCE.pdf,"DP_SYLVESTRE_45GRADOS_WEB.jpg,DP_SYLVESTRE_FRONTAL_WEB.jpg,DP_SYLVESTRE_COMPOSICION_WEB.jpg",DP_SYLVESTRE_AMBIENTE_WEB.jpg,,NATURELLE,SALON ,CUISINE,SALLE DE BAIN,CHEMINÉE,,,MUR INTÉRIEUR,,,,,,PAREMENT MURAL,,
DECOPANEL®  VULCANO,,DECOPANEL,2000054875,Une esthétique noire classique pour les projets plus élégants. Le choix parfait pour vos intérieurs.,https://cupastonefr.servidor.gal/wp-content/uploads/sites/7/recursos/CUADRIPTICO_STONEPANEL_FRANCE.pdf,"DP_VULCANO_45GRADOS_WEB.jpg,DP_VULCANO_FRONTAL_WEB.jpg,DP_VULCANO_COMPOSICION_WEB.jpg",,,NATURELLE,SALON ,CUISINE,SALLE DE BAIN,CHEMINÉE,,,MUR INTÉRIEUR,,,,,,PAREMENT MURAL,,
DECOPANEL® MONTBLANC,,DECOPANEL,2000055016,Crème comme couleur principal avec des teintes blanches. Ce panneu suinte d'un goût vintage et neutre pour vos intérieures.,https://cupastonefr.servidor.gal/wp-content/uploads/sites/7/recursos/CUADRIPTICO_STONEPANEL_FRANCE.pdf,"DP_MONTBLANC_45GRADOS_WEB.jpg,DP_MONTBLANC_FRONTAL_WEB.jpg,DP_MONTBLANC_COMPOSICION_WEB.jpg",,,NATURELLE,SALON ,CUISINE,SALLE DE BAIN,CHEMINÉE,,,MUR INTÉRIEUR,,,,,,PAREMENT MURAL,,
